{
    "id": "ME2236a01",
    "uuid": "https://w3id.org/iqb/unit/e4r5t6z7",
    "modifiedAt": "2026-04-09T13:15:10.977Z",
    "label": "Ein wunderbarer Ausflug",
    "userInterface": {
        "player": "iqb-player-speedtest@4.1",
        "definition": "<p>Bitte warte auf Anweisungen der Testleitung!</p>",
        "isDefinitionInline": true
    }
}
